{
    "kind": "strling.stdlib-guarantee-transition-inventory",
    "contract_version": "1.0.0",
    "inventory_version": "2.0.0",
    "classification": "audited_decisions",
    "entries": [
        {
            "helper_id": "stdlib.date_time",
            "registry_name": "dateTime",
            "classification": "audited",
            "guarantee_status": "audit_ratified",
            "strongest_permitted_claim": "lexical_shape",
            "audit_reference": "spec/stdlib/stdlib-guarantee-audit.json#/helpers/0",
            "source_references": [
                "spec/stdlib/essential_5.json#/patterns/dateTime",
                "spec/stdlib/registry.json#/patterns/4"
            ],
            "remaining_work": [
                "certify_cross_target_behavior",
                "expose_generated_contract"
            ]
        },
        {
            "helper_id": "stdlib.email",
            "registry_name": "email",
            "classification": "audited",
            "guarantee_status": "audit_ratified",
            "strongest_permitted_claim": "lexical_shape",
            "audit_reference": "spec/stdlib/stdlib-guarantee-audit.json#/helpers/1",
            "source_references": [
                "spec/stdlib/essential_5.json#/patterns/email",
                "spec/stdlib/registry.json#/patterns/0"
            ],
            "remaining_work": [
                "certify_cross_target_behavior",
                "expose_generated_contract"
            ]
        },
        {
            "helper_id": "stdlib.ip",
            "registry_name": "ip",
            "classification": "audited",
            "guarantee_status": "audit_ratified",
            "strongest_permitted_claim": "lexical_shape",
            "audit_reference": "spec/stdlib/stdlib-guarantee-audit.json#/helpers/2",
            "source_references": [
                "spec/stdlib/essential_5.json#/patterns/ip",
                "spec/stdlib/registry.json#/patterns/3"
            ],
            "remaining_work": [
                "certify_cross_target_behavior",
                "expose_generated_contract"
            ]
        },
        {
            "helper_id": "stdlib.url",
            "registry_name": "url",
            "classification": "audited",
            "guarantee_status": "audit_ratified",
            "strongest_permitted_claim": "lexical_shape",
            "audit_reference": "spec/stdlib/stdlib-guarantee-audit.json#/helpers/3",
            "source_references": [
                "spec/stdlib/essential_5.json#/patterns/url",
                "spec/stdlib/registry.json#/patterns/1"
            ],
            "remaining_work": [
                "certify_cross_target_behavior",
                "expose_generated_contract"
            ]
        },
        {
            "helper_id": "stdlib.uuid",
            "registry_name": "uuid",
            "classification": "audited",
            "guarantee_status": "audit_ratified",
            "strongest_permitted_claim": "lexical_shape",
            "audit_reference": "spec/stdlib/stdlib-guarantee-audit.json#/helpers/4",
            "source_references": [
                "spec/stdlib/essential_5.json#/patterns/uuid",
                "spec/stdlib/registry.json#/patterns/2"
            ],
            "remaining_work": [
                "certify_cross_target_behavior",
                "expose_generated_contract"
            ]
        }
    ]
}
